### ISSUE TITLE
TunnelSats v2 (Umbrel + LND): docker-tunnelsats containers time out to external HTTPS while WireGuard handshake is OK

### ISSUE THREAD

**Issue by YusukeShimizu** [Tunnelsats/tunnelsats#174]
### Node Setup & Lightning Implementation

Umbrel (LND)

### Operating System

Linux

## Summary

Running `sudo bash setupv2.sh` on an Umbrel + LND host fails at the final "Verifying tunnel" step.

WireGuard appears to be up and healthy (latest handshake updates and transfer increases), and policy routing for the `docker-tunnelsats` subnet is present. However, containers attached to `docker-tunnelsats` time out when attempting to reach external HTTPS endpoints (e.g. https://api.ipify.org).

Packet capture on `tunnelsatsv2` shows outbound TCP SYN packets leaving the interface, but no SYN-ACK replies returning.

## Steps to reproduce

1. Run `sudo bash setupv2.sh`
2. Select:
   - Umbrel
   - LND
3. Observe failure at the final "Verifying tunnel ..." step.

### What did you expect to happen?

- A container attached to `docker-tunnelsats` can reach the public internet over the tunnel (e.g. `curl https://api.ipify.org` succeeds).
- `setupv2.sh` finishes successfully and the tunnel verification passes.

### What actually happened?

- `setupv2.sh` fails at the end with:
  > ERR: TunnelSats VPN interface not successfully activated, please check debug logs

- `curl` from a `docker-tunnelsats` container to an external site times out:
  ```
  curl: (28) Connection timed out after 10000 milliseconds
  ```

- `tcpdump` on `tunnelsatsv2` shows SYN retransmits but no replies.

### 1. WireGuard Status Check

```shell
sudo wg show tunnelsatsv2
```

Observed:
- latest handshake updates (typically within ~1 minute)
- transfer counters increase

This confirms the WireGuard tunnel is established and healthy.

### Control test (regular Docker networking - WORKS):
```shell
sudo docker run --rm curlimages/curl:8.1.1 -4 -sS -m 10 https://api.ipify.org

Output: `<public_ip>` (success)
```

### Failing test (docker-tunnelsats - TIMES OUT):
```shell
sudo docker run --rm --net=docker-tunnelsats curlimages/curl:8.1.1 -4 -sS -m 10 https://api.ipify.org

Output:

curl: (28) Connection timed out after 10000 milliseconds
```

### Packet capture on tunnelsatsv2:
```shell
sudo tcpdump -ni tunnelsatsv2 tcp port 443 -c 3

Output:

IP 10.9.9.2.39210 > 104.26.12.205.443: Flags [S], ...
IP 10.9.9.2.39210 > 104.26.12.205.443: Flags [S], ...
IP 10.9.9.2.39210 > 104.26.12.205.443: Flags [S], ...

(SYN packets leave, but no SYN-ACK replies return)
```

### 4. Relevant Configuration Snippet (REMOVE SENSITIVE DATA)

- **Node software**: Umbrel
- **Lightning implementation**: LND
- **TunnelSats script**: setupv2.sh v0.1.34
- **Host OS**: Linux (Umbrel host)
- **Hardware**: Lenovo ThinkCentre M715q

- **Interface**: tunnelsatsv2
- **AllowedIPs**: 0.0.0.0/0, ::/0
- **Endpoint**: <VPN_ENDPOINT_IP>:51820

```shell
ip rule show
32765:  from 10.9.9.0/25 lookup 51820
ip route show table 51820
```

default dev tunnelsatsv2 scope link metric 2
blackhole default metric 3

sudo docker network inspect docker-tunnelsats

- Subnet: 10.9.9.0/25
- Gateway: 10.9.9.1
- lightning_lnd_1 attached with 10.9.9.9/25

### 5. Logs and Additional Context (Optional)
- TunnelSats had previously been set up for CLN (Core Lightning), then uninstalled; it was reinstalled again for LND for this attempt
- Tailscale was also installed and uninstalled on the same host (during troubleshooting / prior attempts)

**Comment by YusukeShimizu** [comment]
Yes, it happens every time. I have been trying daily, but the connection fails consistently and I haven't been able to connect at all.

**Comment by YusukeShimizu** [comment]
I re-ran `sudo bash setupv2.sh` on my Umbrel + LND host and it now completes successfully.  
The final step shows `Verifying tunnel ...` → `Tunnel is active ✅`, and external HTTPS from a container on `docker-tunnelsats` now works.

**Comment by TrezorHannes** [comment]
> I re-ran `sudo bash setupv2.sh` on my Umbrel + LND host and it now completes successfully. The final step shows `Verifying tunnel ...` → `Tunnel is active ✅`, and external HTTPS from a container on `docker-tunnelsats` now works.

Thanks for confirming. You can use the new `scripts/tunnelsats.sh status` ([FAQ](https://tunnelsats.com/faq#troubleshooting-verification)) to revalidate if it's down, and try the new install routine, too.

Otherwise feel free to close the issue if you think it's resolved.
